[
  {
    "id": "harborline_burger",
    "name": "Harborline Burger Co.",
    "cuisine": "burgers",
    "parent_company": "brightplate_group",
    "ownership_chain": [["quillmere_capital"], ["brightplate_group"]],
    "status": "current",
    "stake_type": "majority",
    "confidence": "confirmed",
    "acquired_year": 2019,
    "exited_year": null,
    "source_url": "https://example.com/sample-source/harborline-acquisition",
    "last_verified": "2026-08-14",
    "independent_group": false
  },
  {
    "id": "tidewater_taqueria",
    "name": "Tidewater Taqueria",
    "cuisine": "mexican",
    "parent_company": "brightplate_group",
    "ownership_chain": [["quillmere_capital"], ["brightplate_group"]],
    "status": "current",
    "stake_type": "majority",
    "confidence": "reported",
    "acquired_year": 2021,
    "exited_year": null,
    "source_url": "https://example.com/sample-source/tidewater-report",
    "last_verified": "2026-06-02",
    "independent_group": false
  },
  {
    "id": "pastaio_fresco",
    "name": "Pastaio Fresco",
    "cuisine": "italian",
    "parent_company": "tamberlake_equity",
    "ownership_chain": [["tamberlake_equity"]],
    "status": "current",
    "stake_type": "minority",
    "confidence": "confirmed",
    "acquired_year": 2021,
    "exited_year": null,
    "source_url": "https://example.com/sample-source/pastaio-investment",
    "last_verified": "2026-09-20",
    "independent_group": false
  },
  {
    "id": "ember_and_rye",
    "name": "Ember & Rye Smokehouse",
    "cuisine": "bbq",
    "parent_company": "corvina_hospitality",
    "ownership_chain": [["tamberlake_equity", "ostravale_partners"], ["corvina_hospitality"]],
    "status": "current",
    "stake_type": "majority",
    "confidence": "confirmed",
    "acquired_year": 2020,
    "exited_year": null,
    "source_url": "https://example.com/sample-source/ember-rye-consortium",
    "last_verified": "2026-07-11",
    "independent_group": false
  },
  {
    "id": "lotus_lane",
    "name": "Lotus Lane Noodle Bar",
    "cuisine": "noodles",
    "parent_company": null,
    "ownership_chain": [["ostravale_partners"]],
    "status": "exited",
    "stake_type": "majority",
    "confidence": "confirmed",
    "acquired_year": 2015,
    "exited_year": 2022,
    "source_url": "https://example.com/sample-source/lotus-lane-sale",
    "last_verified": "2026-05-30",
    "independent_group": false
  },
  {
    "id": "sunmill_bakery",
    "name": "Sunmill Bakery Café",
    "cuisine": "bakery_cafe",
    "parent_company": "quillmere_capital",
    "ownership_chain": [["quillmere_capital"]],
    "status": "current",
    "stake_type": "majority",
    "confidence": "confirmed",
    "acquired_year": 2018,
    "exited_year": null,
    "source_url": "https://example.com/sample-source/sunmill-deal",
    "last_verified": "2023-03-15",
    "independent_group": false
  },
  {
    "id": "copper_kettle",
    "name": "Copper Kettle Diner",
    "cuisine": "american",
    "parent_company": "maplewick_foods",
    "ownership_chain": [["maplewick_foods"]],
    "status": null,
    "stake_type": null,
    "confidence": null,
    "acquired_year": null,
    "exited_year": null,
    "source_url": "https://example.com/sample-source/maplewick-annual-report",
    "last_verified": "2026-04-18",
    "independent_group": false
  },
  {
    "id": "greenbowl",
    "name": "Greenbowl Salads",
    "cuisine": "salads",
    "parent_company": null,
    "ownership_chain": [],
    "status": null,
    "stake_type": null,
    "confidence": null,
    "acquired_year": null,
    "exited_year": null,
    "source_url": null,
    "last_verified": null,
    "independent_group": false
  },
  {
    "id": "hollis_street",
    "name": "Hollis Street Kitchens",
    "cuisine": "american",
    "parent_company": null,
    "ownership_chain": [],
    "status": null,
    "stake_type": null,
    "confidence": null,
    "acquired_year": null,
    "exited_year": null,
    "source_url": null,
    "last_verified": null,
    "independent_group": true
  }
]
